{"generation":"synthetic-reviewed-1","keys":[],"pins":[{"candidate_id":"sha256:645795af3c440b5a3d47cc4ebf9daf5d28f91399477fb3c20eb4f8955f3140a1","fingerprint":"sha256:e135bba4b8b8e6f90d2da27c9545929f769f9cd1322711f7c9ed2ee63afc074b","require_artifact":false,"require_dependencies":false,"require_runtime_attestation":false,"required_signer":null,"schema_version":"0.1"}],"schema_version":"0.1","status":"REVIEWED"}
